{
  "case_id": "positive-fenced-sources",
  "category": "positive",
  "input_id": "fenced-sources.md",
  "source": "```rust  exact\r\nalpha\r\nbeta\n```  \n\n> ```mermaid\r\n> graph TD\r\n> ```\r\n\r\n- ```query\n  tag:#x\n  ```\n\n```view\nbody",
  "expected": {
    "target_kind_ids": [],
    "anchor_kind_ids": [],
    "fenced_sources": [
      {
        "tag": "docwen-fenced-source-v1:dbaeeface5ff72416c6cead9f1fe93ce",
        "source_sha256": "1ce4025ce688a4267b5e8348acf8fa4c5015ea9c5e9bf81732dc0b2130ac4d0a",
        "source_start": 0,
        "source_end": 34,
        "identity_sha256": "dbaeeface5ff72416c6cead9f1fe93cecd57ad5cdf45fcde48f726ee8e0b94ef",
        "block_sha256": "7e8f4985388f83e1e30e9b887255c8c4a740137165e55f6b99c6d4e2d6f6ae37",
        "body_sha256": "4f85d1b0cff7bb76f0c9a58366030c6dc1eb8e1243e3709c72452278ddce7c13",
        "fence_character": "`",
        "opening_length": 3,
        "opening_prefix_b64": "",
        "info_b64": "cnVzdCAgZXhhY3Q=",
        "opening_eol": "\r\n",
        "body_prefix_count": 2,
        "body_prefixes_b64": "AA==",
        "closing_state": "present",
        "closing_length": 3,
        "closing_prefix_b64": "",
        "closing_suffix_b64": "ICA=",
        "closing_eol": "\n"
      },
      {
        "tag": "docwen-fenced-source-v1:7628fc865550e486e909a5ca755b9019",
        "source_sha256": "1ce4025ce688a4267b5e8348acf8fa4c5015ea9c5e9bf81732dc0b2130ac4d0a",
        "source_start": 35,
        "source_end": 68,
        "identity_sha256": "7628fc865550e486e909a5ca755b90192ad9c246e10a7ab635a2520e0e67b9e1",
        "block_sha256": "67f255d72886d9555912521a8e45319eb577d938b64cd19fbdb51efe55e429a9",
        "body_sha256": "3acf0dde2097b378727272729d03273dc6b59118a7e4aa2425ed644f36726c5b",
        "fence_character": "`",
        "opening_length": 3,
        "opening_prefix_b64": "PiA=",
        "info_b64": "bWVybWFpZA==",
        "opening_eol": "\r\n",
        "body_prefix_count": 1,
        "body_prefixes_b64": "PiA=",
        "closing_state": "present",
        "closing_length": 3,
        "closing_prefix_b64": "PiA=",
        "closing_suffix_b64": "",
        "closing_eol": "\r\n"
      },
      {
        "tag": "docwen-fenced-source-v1:2fecc312412a3b047efa2f7f6c514b8f",
        "source_sha256": "1ce4025ce688a4267b5e8348acf8fa4c5015ea9c5e9bf81732dc0b2130ac4d0a",
        "source_start": 70,
        "source_end": 96,
        "identity_sha256": "2fecc312412a3b047efa2f7f6c514b8f561c261ad06d001eb0a4bee1072f3eaf",
        "block_sha256": "91d82866af80a7fb62e5288ee727463444d4b3fa10681114ad0e438605ed110a",
        "body_sha256": "b1393ba82c7f28a2a27e3007b27233b24b5d51c1f6bc23744689e036f6b62d6d",
        "fence_character": "`",
        "opening_length": 3,
        "opening_prefix_b64": "LSA=",
        "info_b64": "cXVlcnk=",
        "opening_eol": "\n",
        "body_prefix_count": 1,
        "body_prefixes_b64": "ICA=",
        "closing_state": "present",
        "closing_length": 3,
        "closing_prefix_b64": "ICA=",
        "closing_suffix_b64": "",
        "closing_eol": "\n"
      },
      {
        "tag": "docwen-fenced-source-v1:61dcfb2f1388c84e014975aa31a8a7a4",
        "source_sha256": "1ce4025ce688a4267b5e8348acf8fa4c5015ea9c5e9bf81732dc0b2130ac4d0a",
        "source_start": 97,
        "source_end": 109,
        "identity_sha256": "61dcfb2f1388c84e014975aa31a8a7a472979645e2eac9d7e19147b2e2e3cc68",
        "block_sha256": "51f623fe20a1f97a6875b5d3d12d94ffb8ae380a75f9d0b30bf6ac1d89ac9188",
        "body_sha256": "230d8358dc8e8890b4c58deeb62912ee2f20357ae92a5cc861b98e68fe31acb5",
        "fence_character": "`",
        "opening_length": 3,
        "opening_prefix_b64": "",
        "info_b64": "dmlldw==",
        "opening_eol": "\n",
        "body_prefix_count": 1,
        "body_prefixes_b64": "",
        "closing_state": "omitted_eof",
        "closing_length": 0,
        "closing_prefix_b64": "",
        "closing_suffix_b64": "",
        "closing_eol": ""
      }
    ],
    "link_kinds": [],
    "reference_statuses": [],
    "citation_keys": [],
    "diagnostics": [],
    "source_unchanged": true
  }
}
